question,ans,law_ref,visatype,risklevel,notes
What is a J-1 visa?,"The J-1 visa is a nonimmigrant visa for individuals approved to participate in work-and-study-based exchange visitor programs in the U.S.","22 CFR 62.1","J-1","low","Definition-level question."
Who qualifies for a J-1 visa?,"Those accepted into an exchange program approved by the U.S. Department of State, such as research scholars, students, and interns.","22 CFR 62.4","J-1","low","Eligibility definition."
Can J-1 visa holders work in the U.S.?,"Yes, but only as authorized by the terms of their specific J-1 program and sponsor.","22 CFR 62.16","J-1","medium","Employment tied to program rules."
Do J-1 visa holders need health insurance?,"Yes, J-1 participants must maintain health insurance meeting Department of State requirements for themselves and any J-2 dependents.","22 CFR 62.14","J-1","medium","Mandatory coverage."
How long can I stay on a J-1 visa?,"Your stay is limited to the duration of your program as stated on your DS-2019, plus a 30-day grace period.","22 CFR 62.43","J-1","low","Duration tied to DS-2019."
What is a DS-2019 form?,"The DS-2019 is the Certificate of Eligibility issued by a designated program sponsor, needed for a J-1 visa application.","22 CFR 62.12","J-1","low","Essential application form."
Can J-1 holders apply for a Social Security Number?,"Yes, if authorized to work under their J-1 program, they may apply for an SSN.","SSA J-1 Guidance","J-1","low","Requires work authorization."
Do J-1 holders pay U.S. taxes?,"Yes, J-1 visa holders may be subject to federal, state, and local taxes depending on income and tax treaty benefits.","IRS J-1 Tax Guide","J-1","medium","Varies by treaty."
Can I extend my J-1 program?,"Yes, with sponsor approval and USCIS/State Department notification before your current DS-2019 expires.","22 CFR 62.43","J-1","medium","Must maintain status."
Can I travel while on a J-1 visa?,"Yes, but you need a valid J-1 visa stamp, DS-2019 travel signature, and valid status to reenter.","22 CFR 62.42","J-1","low","Travel signature needed."
What is the 2-year home residency requirement?,"Some J-1 programs require you to return to your home country for 2 years before applying for certain U.S. visas or permanent residence.","INA 212(e)","J-1","high","Significant restriction."
How do I know if I’m subject to the 2-year rule?,"Check your DS-2019 and visa stamp; consult your program sponsor or a U.S. embassy for confirmation.","INA 212(e)","J-1","high","Critical for future plans."
Can the 2-year home residency requirement be waived?,"Yes, through options like a no-objection statement, hardship, persecution, or an interested government agency request.","INA 212(e) Waivers","J-1","high","Legal waiver process."
Can J-1 holders change status to H-1B?,"Yes, but if subject to the 2-year rule, you must fulfill it or get a waiver first.","INA 212(e)","J-1","high","Subject to waiver."
Can J-1 holders bring dependents?,"Yes, eligible dependents can apply for J-2 visas.","22 CFR 62.2","J-1","low","J-2 for spouse/children."
What happens if I overstay my J-1 visa?,"Overstaying can lead to status violations, unlawful presence bars, and future visa denials.","INA 212(a)(9)","J-1","high","Serious immigration violation."
Can J-1 students work on campus?,"Yes, with sponsor authorization and within program rules.","22 CFR 62.23(g)","J-1","low","On-campus permitted."
Can J-1 students do academic training?,"Yes, with written sponsor approval; training must be related to your field of study.","22 CFR 62.23(f)","J-1","medium","AT rules apply."
Do J-1 teachers have special program rules?,"Yes, they must meet teaching experience, qualifications, and cultural exchange requirements.","22 CFR 62.24","J-1","medium","Teacher-specific regulations."
Can J-1 interns be unpaid?,"Yes, if the internship meets program standards and complies with labor laws.","22 CFR 62.22","J-1","medium","Must meet program and labor rules."
Can J-1 holders change their program sponsor?,"Yes, but you need written release from your current sponsor and acceptance from a new designated sponsor.","22 CFR 62.42","J-1","medium","Sponsor transfer rules."
Is there a grace period after my J-1 program ends?,"Yes, you have 30 days to prepare for departure, but you cannot work during this period.","22 CFR 62.43","J-1","low","No work in grace period."
Can J-1 researchers work at multiple sites?,"Yes, if authorized by their sponsor and included on the DS-2019.","22 CFR 62.20","J-1","medium","Must be documented."
Are J-1 au pairs subject to a maximum stay?,"Yes, generally 12 months with possible extensions to 24 months under certain conditions.","22 CFR 62.31","J-1","medium","Program-specific."
Can J-1 scholars change to tourist status?,"Yes, by applying to USCIS before your J-1 status expires, but some restrictions apply.","8 CFR 248.1","J-1","medium","Subject to 2-year rule."
Can I volunteer on a J-1 visa?,"Yes, genuine volunteer activities not replacing paid work are allowed.","DOL Guidance on Volunteers","J-1","low","Ensure compliance."
Do J-1 holders need to inform SEVIS of address changes?,"Yes, within 10 days through your sponsor.","8 CFR 214.2(j)","J-1","low","Sponsor updates SEVIS."
What happens if my sponsor withdraws my DS-2019?,"Your J-1 status ends and you must depart or apply for a change of status immediately.","22 CFR 62.40","J-1","high","Immediate impact."
Are J-1 exchange visitors covered by U.S. labor laws?,"Yes, they are protected by applicable federal, state, and local labor laws.","DOL Exchange Visitor Rights","J-1","medium","Labor law protections apply."
Can J-1 students work off-campus?,"Yes, only through approved Academic Training or in cases of serious economic hardship with sponsor and USCIS approval.","8 CFR 214.2(j)(1)(v)","J-1","medium","Requires approval."
Do J-1 visas allow multiple entries?,"Yes, if your visa stamp is marked 'M' for multiple entries and you have valid documents.","Visa Foil Guidance","J-1","low","Depends on visa foil."
Can J-1 physicians train in the U.S.?,"Yes, under specific graduate medical education programs approved by ECFMG.","22 CFR 62.27","J-1","high","Special program category."
Is English proficiency required for J-1?,"Yes, applicants must demonstrate sufficient English to participate effectively in their program.","22 CFR 62.10(a)(2)","J-1","low","Proficiency proof needed."
What if I lose my passport while on J-1?,"Report it immediately, obtain a new passport, and update your sponsor and SEVIS record.","DOS Lost Passport Guidance","J-1","medium","Security and status impact."
Can J-1 visas be issued for part-time programs?,"Generally no, except for certain short-term scholar or specialist categories.","22 CFR 62.21","J-1","medium","Mostly full-time programs."
Can a J-1 holder change field of study?,"Only with sponsor approval and within program category limitations.","22 CFR 62.23","J-1","medium","Limited flexibility."
Do J-1 holders get unemployment benefits?,"Generally no, unless permitted by state law and authorized employment history.","State UI Guidance","J-1","low","Varies by state."
What happens if my J-1 program is terminated early?,"Your status ends immediately; you may have to depart the U.S. without a grace period.","22 CFR 62.40","J-1","high","No grace if terminated for cause."
Can J-1 visa holders be self-employed?,"No, unless self-employment is explicitly part of the program and approved by sponsor.","22 CFR 62.16","J-1","high","Program must allow it."
Can a J-1 be reinstated after status violation?,"Possibly, if you apply promptly and meet eligibility criteria; otherwise, you must depart and reapply.","8 CFR 214.2(j)(1)(vi)","J-1","high","Reinstatement is rare."
Can J-1 holders get a Social Security Number?,"Yes, if you have authorized employment; bring DS-2019, passport, I-94, and job offer to the SSA office.","SSA Policy for Exchange Visitors","J-1","low","Employment authorization required."
Are J-1 interns allowed to switch host companies?,"Only with sponsor approval and if consistent with the original training plan.","22 CFR 62.22","J-1","medium","Must maintain program objectives."
Do J-1 holders pay U.S. income tax?,"Yes, most J-1 holders are subject to federal and state taxes on U.S.-source income, though some may benefit from tax treaties.","IRS Publication 519","J-1","medium","Check tax treaty status."
Can J-1 research scholars bring dependents?,"Yes, spouses and children can come on J-2 visas.","8 CFR 214.2(j)(1)(ii)","J-1","low","J-2 eligibility linked to J-1."
Are J-1s covered by minimum wage laws?,"Yes, J-1 participants must be paid at least the applicable minimum wage unless the role is unpaid training explicitly approved.","FLSA Guidance","J-1","medium","Wage laws apply."
Is travel allowed during J-1 program?,"Yes, but you must have a valid visa stamp, DS-2019 with travel signature, and comply with program conditions.","DOS Travel Guidance","J-1","low","Sponsor signature required."
Can J-1 teachers work at multiple schools?,"Only if approved by sponsor and consistent with program objectives.","22 CFR 62.24","J-1","medium","Multiple sites require approval."
Do J-1 holders need health insurance for dependents?,"Yes, sponsors must ensure both J-1 and J-2 dependents have required health insurance coverage.","22 CFR 62.14","J-1","medium","Minimum coverage levels apply."
Can a J-1 be denied entry after visa issuance?,"Yes, CBP officers at the port of entry can deny admission if they find you inadmissible.","INA 212","J-1","high","Admission is not guaranteed."
What if my J-1 sponsor loses designation?,"You must transfer to another designated sponsor or leave the U.S.","22 CFR 62.50","J-1","high","Program disruption possible."
